{
  "CityObjects": {
    "id-1": {
      "geometry": [
        {
          "boundaries": [
            [
              [
                [
                  0, 
                  3, 
                  2, 
                  1
                ]
              ], 
              [
                [
                  4, 
                  5, 
                  6, 
                  7
                ]
              ], 
              [
                [
                  8, 
                  9, 
                  5, 
                  4
                ]
              ], 
              [
                [
                  9, 
                  2, 
                  6, 
                  5
                ]
              ], 
              [
                [
                  2, 
                  3, 
                  7, 
                  6
                ]
              ], 
              [
                [
                  3, 
                  1, 
                  4, 
                  7
                ]
              ]
            ]
          ], 
          "type": "Solid", 
          "lod": 1
        }
      ], 
      "type": "GenericCityObject"
    }
  }, 
  "version": "http://www.cityjson.org/version/0.2", 
  "type": "CityModel", 
  "vertices": [
    [
      0.0, 
      0.0, 
      0.0
    ], 
    [
      1.0, 
      0.0, 
      0.0
    ], 
    [
      1.0, 
      1.0, 
      0.0
    ], 
    [
      0.0, 
      1.0, 
      0.0
    ], 
    [
      0.0, 
      0.0, 
      1.0
    ], 
    [
      1.0, 
      0.0, 
      1.0
    ], 
    [
      1.0, 
      1.0, 
      1.0
    ], 
    [
      0.0, 
      1.0, 
      1.0
    ], 
    [
      0.0, 
      0.0, 
      0.0
    ], 
    [
      1.0, 
      0.0, 
      0.0
    ]
  ]
}